{
  "id": "enemy_boneco_treino",
  "versao": 1,
  "nota": "Boneco de treino do pátio do Torvan (v0.1.2b): não age, só recebe dano; sem XP, moedas nem drops. Valores do 03 para destravar; o 06 ajusta a ficha no bestiário.",
  "nome_txt": "txt_enemy_boneco_treino_nome",
  "papel": "combatente",
  "treino": true,
  "sprite": "enemy_boneco_treino",
  "vida_max": 200,
  "forca": 0,
  "defesa": 1,
  "agilidade": 0,
  "resistencias": {},
  "xp": 0,
  "moedas": 0,
  "drops": [],
  "ia": [],
  "poses": {
    "parado": "bat_parado",
    "dano": "bat_dano",
    "morte": "bat_morte"
  }
}
